{
  "schema_version": "n5-d5-l2d-replay-role-policy-1.0",
  "record_kind": "OUT_OF_BAND_PINNED_REPLAY_AND_ROLE_POLICY",
  "policy_id": "replace_l2d_policy_id",
  "policy_epoch": 1,
  "valid_from_utc": "2026-01-01T00:00:00Z",
  "valid_until_utc": "2027-01-01T00:00:00Z",
  "expected_predicate_type": "https://gaoyouyang.github.io/oerf-bishe-dashboard/attestations/n5-d5-l2d-replay-role/v1",
  "ledger_namespace": "oerf_n5_d5_describe_authorizations_v1",
  "log_id": "replace_external_log_id",
  "log_epoch": 1,
  "required_signature_roles": [
    "acceptance_sequencer",
    "checkpoint_monitor_a",
    "checkpoint_monitor_b"
  ],
  "signature_threshold": 3,
  "max_witnessed_prefix_entries": 256,
  "max_bundle_lifetime_seconds": 900,
  "max_checkpoint_age_seconds": 900,
  "max_merge_delay_seconds": 120,
  "floor_checkpoint": {
    "tree_size": 0,
    "root_sha256": "e3b0c44298fc1c149afbf4c8996fb92427ae41e4649b934ca495991b7852b855"
  },
  "trusted_keys": [
    {
      "key_id": "replace_acceptance_sequencer_key",
      "role": "acceptance_sequencer",
      "algorithm": "ed25519",
      "public_key_base64": "AAAAAAAAAAAAAAAAAAAAAAAAAAAAAAAAAAAAAAAAAAA=",
      "operator_domain_id": "replace_sequencer_operator_domain",
      "service_identity_uri": "https://replace.invalid/sequencer",
      "credential_issuer_uri": "https://replace.invalid/sequencer-issuer"
    },
    {
      "key_id": "replace_checkpoint_monitor_a_key",
      "role": "checkpoint_monitor_a",
      "algorithm": "ed25519",
      "public_key_base64": "AAAAAAAAAAAAAAAAAAAAAAAAAAAAAAAAAAAAAAAAAAA=",
      "operator_domain_id": "replace_monitor_a_operator_domain",
      "service_identity_uri": "https://replace.invalid/monitor-a",
      "credential_issuer_uri": "https://replace.invalid/monitor-a-issuer"
    },
    {
      "key_id": "replace_checkpoint_monitor_b_key",
      "role": "checkpoint_monitor_b",
      "algorithm": "ed25519",
      "public_key_base64": "AAAAAAAAAAAAAAAAAAAAAAAAAAAAAAAAAAAAAAAAAAA=",
      "operator_domain_id": "replace_monitor_b_operator_domain",
      "service_identity_uri": "https://replace.invalid/monitor-b",
      "credential_issuer_uri": "https://replace.invalid/monitor-b-issuer"
    }
  ],
  "claim_authorizations": {
    "real_bost_interface": false,
    "physical_forward_correctness": false,
    "derivative_correctness": false,
    "reconstruction": false,
    "algorithm_superiority": false,
    "generalization": false,
    "publication": false
  }
}
